{
  "$schema": "./models.schema.json",
  "schemaVersion": 1,
  "catalogVersion": "1.1.0",
  "verifiedOn": "2026-07-16",
  "models": [
    {
      "provider": "Ollama",
      "tag": "qwen2.5-coder:0.5b",
      "expectedDigest": "4ff64a7f502a",
      "expectedDownloadBytes": 398000000,
      "family": "Qwen2.5-Coder",
      "parameterBillions": 0.494,
      "intendedTasks": "Repeated-pattern inspection, log grouping, simple fixture and edge-case suggestions.",
      "minimumDedicatedVramGiB": 0.75,
      "recommendedDedicatedVramGiB": 1.25,
      "minimumSystemRamGiB": 4,
      "recommendedSystemRamGiB": 8,
      "minimumFreeDiskGiB": 2,
      "safeDefaultContextTokens": 2048,
      "maximumContextTokens": 4096,
      "performanceTier": "entry",
      "cpuFallbackReasonable": true,
      "automaticSelectionAllowed": true,
      "licenseName": "Apache License 2.0",
      "licenseUrl": "https://www.apache.org/licenses/LICENSE-2.0",
      "commercialUseAllowed": true,
      "sourceUrl": "https://ollama.com/library/qwen2.5-coder:0.5b",
      "verifiedOn": "2026-07-13"
    },
    {
      "provider": "Ollama",
      "tag": "qwen2.5-coder:1.5b",
      "expectedDigest": "d7372fd82851",
      "expectedDownloadBytes": 986000000,
      "family": "Qwen2.5-Coder",
      "parameterBillions": 1.54,
      "intendedTasks": "Checklist comparison, obvious code smells, categorization, small fixture generation.",
      "minimumDedicatedVramGiB": 1.25,
      "recommendedDedicatedVramGiB": 2.0,
      "minimumSystemRamGiB": 8,
      "recommendedSystemRamGiB": 12,
      "minimumFreeDiskGiB": 3,
      "safeDefaultContextTokens": 4096,
      "maximumContextTokens": 8192,
      "performanceTier": "entry",
      "cpuFallbackReasonable": true,
      "automaticSelectionAllowed": true,
      "licenseName": "Apache License 2.0",
      "licenseUrl": "https://www.apache.org/licenses/LICENSE-2.0",
      "commercialUseAllowed": true,
      "sourceUrl": "https://ollama.com/library/qwen2.5-coder:1.5b",
      "verifiedOn": "2026-07-13"
    },
    {
      "provider": "Ollama",
      "tag": "qwen2.5-coder:3b",
      "expectedDigest": "f72c60cabf62",
      "expectedDownloadBytes": 1900000000,
      "family": "Qwen2.5-Coder",
      "parameterBillions": 3.09,
      "intendedTasks": "Bounded small-diff review and test-failure hypotheses, only when its separate license is acceptable.",
      "minimumDedicatedVramGiB": 3.0,
      "recommendedDedicatedVramGiB": 4.0,
      "minimumSystemRamGiB": 10,
      "recommendedSystemRamGiB": 16,
      "minimumFreeDiskGiB": 5,
      "safeDefaultContextTokens": 4096,
      "maximumContextTokens": 8192,
      "performanceTier": "mid",
      "cpuFallbackReasonable": true,
      "automaticSelectionAllowed": false,
      "licenseName": "Qwen Research License Agreement",
      "licenseUrl": "https://registry.ollama.com/library/qwen2.5-coder:3b-base-q5_0/blobs/45fc3ea7579a",
      "commercialUseAllowed": false,
      "sourceUrl": "https://ollama.com/library/qwen2.5-coder:3b",
      "verifiedOn": "2026-07-13"
    },
    {
      "provider": "Ollama",
      "tag": "qwen2.5-coder:7b",
      "expectedDigest": "dae161e27b0e",
      "expectedDownloadBytes": 4700000000,
      "family": "Qwen2.5-Coder",
      "parameterBillions": 7.62,
      "intendedTasks": "Bounded diff review, test-failure analysis, repository mapping, debugging hypotheses.",
      "minimumDedicatedVramGiB": 5.5,
      "recommendedDedicatedVramGiB": 8.0,
      "minimumSystemRamGiB": 16,
      "recommendedSystemRamGiB": 24,
      "minimumFreeDiskGiB": 10,
      "safeDefaultContextTokens": 8192,
      "maximumContextTokens": 16384,
      "performanceTier": "mid",
      "cpuFallbackReasonable": true,
      "automaticSelectionAllowed": true,
      "licenseName": "Apache License 2.0",
      "licenseUrl": "https://www.apache.org/licenses/LICENSE-2.0",
      "commercialUseAllowed": true,
      "sourceUrl": "https://ollama.com/library/qwen2.5-coder:7b",
      "verifiedOn": "2026-07-13"
    },
    {
      "provider": "Ollama",
      "tag": "qwen2.5-coder:14b",
      "expectedDigest": "9ec8897f747e",
      "expectedDownloadBytes": 9000000000,
      "family": "Qwen2.5-Coder",
      "parameterBillions": 14.8,
      "intendedTasks": "Broader read-only review, multi-file failure analysis, and edge-case generation.",
      "minimumDedicatedVramGiB": 11.0,
      "recommendedDedicatedVramGiB": 16.0,
      "minimumSystemRamGiB": 24,
      "recommendedSystemRamGiB": 32,
      "minimumFreeDiskGiB": 18,
      "safeDefaultContextTokens": 12288,
      "maximumContextTokens": 24576,
      "performanceTier": "high",
      "cpuFallbackReasonable": false,
      "automaticSelectionAllowed": true,
      "licenseName": "Apache License 2.0",
      "licenseUrl": "https://www.apache.org/licenses/LICENSE-2.0",
      "commercialUseAllowed": true,
      "sourceUrl": "https://ollama.com/library/qwen2.5-coder:14b",
      "verifiedOn": "2026-07-13"
    },
    {
      "provider": "Ollama",
      "tag": "qwen3:8b",
      "expectedDigest": "500a1f067a9f",
      "expectedDownloadBytes": 5225388164,
      "family": "Qwen3",
      "parameterBillions": 8.19,
      "intendedTasks": "Low-impact bounded review, log triage, small diffs, test-failure grouping, and edge-case suggestions.",
      "minimumDedicatedVramGiB": 6.0,
      "recommendedDedicatedVramGiB": 8.0,
      "minimumSystemRamGiB": 16,
      "recommendedSystemRamGiB": 24,
      "minimumFreeDiskGiB": 12,
      "safeDefaultContextTokens": 8192,
      "maximumContextTokens": 32768,
      "performanceTier": "mid",
      "cpuFallbackReasonable": true,
      "automaticSelectionAllowed": true,
      "licenseName": "Apache License 2.0",
      "licenseUrl": "https://www.apache.org/licenses/LICENSE-2.0",
      "commercialUseAllowed": true,
      "sourceUrl": "https://ollama.com/library/qwen3:8b",
      "verifiedOn": "2026-07-16"
    },
    {
      "provider": "Ollama",
      "tag": "qwen3:14b",
      "expectedDigest": "bdbd181c33f2",
      "expectedDownloadBytes": 9276198565,
      "family": "Qwen3",
      "parameterBillions": 14.8,
      "intendedTasks": "Normal bounded code review, multi-file failure analysis, repository mapping, and broader edge-case generation.",
      "minimumDedicatedVramGiB": 11.0,
      "recommendedDedicatedVramGiB": 16.0,
      "minimumSystemRamGiB": 24,
      "recommendedSystemRamGiB": 32,
      "minimumFreeDiskGiB": 18,
      "safeDefaultContextTokens": 16384,
      "maximumContextTokens": 32768,
      "performanceTier": "high",
      "cpuFallbackReasonable": false,
      "automaticSelectionAllowed": true,
      "licenseName": "Apache License 2.0",
      "licenseUrl": "https://www.apache.org/licenses/LICENSE-2.0",
      "commercialUseAllowed": true,
      "sourceUrl": "https://ollama.com/library/qwen3:14b",
      "verifiedOn": "2026-07-16"
    },
    {
      "provider": "Ollama",
      "tag": "qwen3-coder:30b",
      "expectedDigest": "06c1097efce0",
      "expectedDownloadBytes": 18556688736,
      "family": "Qwen3-Coder MoE",
      "parameterBillions": 30.5,
      "intendedTasks": "Strong bounded advisory code review and complex failure analysis; final decisions stay with Codex.",
      "minimumDedicatedVramGiB": 21.5,
      "recommendedDedicatedVramGiB": 24.0,
      "minimumSystemRamGiB": 48,
      "recommendedSystemRamGiB": 64,
      "minimumFreeDiskGiB": 36,
      "safeDefaultContextTokens": 16384,
      "maximumContextTokens": 32768,
      "performanceTier": "enthusiast",
      "cpuFallbackReasonable": false,
      "automaticSelectionAllowed": true,
      "licenseName": "Apache License 2.0",
      "licenseUrl": "https://www.apache.org/licenses/LICENSE-2.0",
      "commercialUseAllowed": true,
      "sourceUrl": "https://ollama.com/library/qwen3-coder:30b",
      "verifiedOn": "2026-07-13"
    },
    {
      "provider": "Ollama",
      "tag": "qwen2.5-coder:32b",
      "expectedDigest": "b92d6a0bd47e",
      "expectedDownloadBytes": 20000000000,
      "family": "Qwen2.5-Coder",
      "parameterBillions": 32.8,
      "intendedTasks": "Strong bounded advisory review on systems with substantial headroom.",
      "minimumDedicatedVramGiB": 22.5,
      "recommendedDedicatedVramGiB": 24.0,
      "minimumSystemRamGiB": 48,
      "recommendedSystemRamGiB": 64,
      "minimumFreeDiskGiB": 38,
      "safeDefaultContextTokens": 16384,
      "maximumContextTokens": 32768,
      "performanceTier": "enthusiast",
      "cpuFallbackReasonable": false,
      "automaticSelectionAllowed": false,
      "licenseName": "Apache License 2.0",
      "licenseUrl": "https://www.apache.org/licenses/LICENSE-2.0",
      "commercialUseAllowed": true,
      "sourceUrl": "https://ollama.com/library/qwen2.5-coder:32b",
      "verifiedOn": "2026-07-13"
    }
  ]
}
